subreddit,title,selftext,score,created_utc,url,permalink
MechanicAdvice,Am I getting scammed? I’m,"I’m very unfamiliar with cars. 

My mom has been going to and insisting on me taking my car to this certain dealership because she knows a guy there. But I feel like I’ve been getting charged a lot more than I should, especially now. I wanted to know other people’s opinions. 

Context: Few days ago I heard something dragging underneath my car. I also broke my 
wheel cover? (Idk the name). 

My car is a 2013 Honda Civic with almost 200k miles. 

Is $735 accurate for having my transmission fluid drained, and the two issues in the photos I provided? Idk what else they did. 

My mom is as ignorant as I am when it comes to cars, but she claims “I’m in good hands.”",123,2025-07-11 09:27:26,https://www.reddit.com/gallery/1lxbdhc,https://www.reddit.com/r/MechanicAdvice/comments/1lxbdhc/am_i_getting_scammed_im/
MechanicAdvice,Car not going into gear (was fine when parked last night),"Hi everyone! This is my 1988 AE92 Toyota Corolla SR5. Just got this last night and drove it 50 miles home, ran perfectly. Felt no issues with the clutch or shifter at all yesterday and I didn't push it too hard on the way home either (no hard launches, stalled it a couple times however). Ran perfectly when parked 8 hours ago, now shifter won't go into the gears when the car is running. 

Clutch seems to be engaging (tried to push car with the shifter in 3rd, engine off, and it was significantly harder to push than when it neutral). 

Any and all advice is greatly appreciated! Sorry I sound frustrated in the video. Thank you all for your time. ",1,2025-07-11 09:17:44,https://v.redd.it/a30lc06ts9cf1,https://www.reddit.com/r/MechanicAdvice/comments/1lxb4aa/car_not_going_into_gear_was_fine_when_parked_last/
MechanicAdvice,"2003 Honda Odyssey rear doors/hatch auto lock unless a front door is open, how do I disable or fix?","My 2003 Honda Odyssey EX-L has the standard security/alarm system. For the past year and a half, when unlocked with the key fob (different fobs have been used, confirmed not a fob issue) the car will lock itself again within about a minute. If either sliding door or the rear hatch are open, it will still lock, then the alarm will go off once closed. Keys have been locked inside the car numerous times because of this, leaving the alarm blaring.
The only thing that stops it from auto-locking is opening one of the front doors. The front doors can be closed again and it will stop it from auto locking.
This has been incredibly frustrating when running to the car to grab something out of the back and not getting it closed back up in time.

Is there a way to disable the auto locking, or fix whatever is not recognizing that sliding doors or rear hatch are open?",1,2025-07-11 09:09:21,https://www.reddit.com/r/MechanicAdvice/comments/1lxawka/2003_honda_odyssey_rear_doorshatch_auto_lock/,https://www.reddit.com/r/MechanicAdvice/comments/1lxawka/2003_honda_odyssey_rear_doorshatch_auto_lock/
MechanicAdvice,2018 Silverado. Chevy recommends tranny replacement! No issues!,"I took my 2018 Silverado 1500 LTZ 70,800 miles, in for a checkup because the hard shift from auto stop seemed to be getting a little worse.  Only when I accelerate as it tries to start, a problem since new, but was shifting a little harder and I figured hey, maybe they can do an adjustment, like the old days band adjustment or something.

They take the vehicle for a drive. Mechanic reports he cannot replicate any issue. They do a fluid check. And recommend  TRANNY REPLACEMENT for $11,000!

They claim small metal particles on a magnet mean replace.  They show me video and photo that just looks like used fluid. Perfectly working tranny but needs replacement. Huh?  You cannot just change the clutch pack or whatever worn part?

I say hell no. Just change the fluid. They change fluid, truck works like a dream. No hard shifting.  I start to wonder, did they even do the 45,000 mile maintenance I brought it in for at 47K? I had them pull records. It says 45,000 maintenance -BASIC. I do some googling, and I am reading about ""might change fluid if req""! The document shows no 10X $$$ for the fluid or anything. Anyone know what a 45,000 mile -BASIC is for a Silverado 1500? The manual says to replace tranny fluid & filter.   

What do mechanics think of all this? Is it normal to call for a complete replacement based on a fluid check? Would a complete replacement even be the recommended move under any circumstance with a well working transmission?

",1,2025-07-11 09:04:26,https://www.reddit.com/r/MechanicAdvice/comments/1lxarzs/2018_silverado_chevy_recommends_tranny/,https://www.reddit.com/r/MechanicAdvice/comments/1lxarzs/2018_silverado_chevy_recommends_tranny/
MechanicAdvice,2015 Kia Sportage – Power Windows Issue,,1,2025-07-11 09:00:49,/r/kia/comments/1lx6kz1/2015_kia_sportage_power_windows_issue/,https://www.reddit.com/r/MechanicAdvice/comments/1lxaoeo/2015_kia_sportage_power_windows_issue/
MechanicAdvice,"P0171 Lean code, STFT B1S2 99.2%","Decided to come to you guys to see if you can make heads or tails of my current situation, posted it on the FEOA forums(ford escort owners association) but with no luck yet:

For starters my car is a '98 ford escort ZX2 with the 2.0 DOHC I4 that I got last month and was enjoying till it started having issues sticking at 3000rpm but hasn't done since, but the current issues at hand instead trying to fix that is a P0171 code and the B1S2 STFT being 99.2% while also feeling like its stumbling at idle if you turn off the ac which I use to just keep the rpm's up at 900-1200 but if you don't it will sit at 700 before eventually dipping lower and lower until it dies.

I have replaced a couple parts in hopes it fixes the issue(and some for maintanence) as per a friends suggestion but to no luck, parts I replaced was:

PCV
PCV elbow and hose
Cleaned and regasketed the iac valve
Cleaned maf sensor
Changed spark plugs
Changed plug wires
New rad cap(was holding no pressure).


Started looking around for vaccum leaks and found one which I'm guessing was the pcv hose which I replaced the clamp on but is still suffering from high fuel trims so now I'm rather stuck as that did deal with the audible vaccum leak but is still having trouble.

Also after those fixes I did try clearing the code two or three days ago which has yet to come back after 27 miles of easy and hard driving but is still asking for 99.2% fuel trim (friend also suggested I take off the negative cable for half hour to see if it has any effect on fuel trim, going to try after I post this), will attach a video I took if it helps and will be curious to hear what you guys think is going on. Thanks.",1,2025-07-11 08:57:18,https://v.redd.it/sfvyr3h5p9cf1,https://www.reddit.com/r/MechanicAdvice/comments/1lxakz9/p0171_lean_code_stft_b1s2_992/
MechanicAdvice,Verna adas issue,,2,2025-07-11 08:56:27,https://i.redd.it/r9n5ynkno9cf1.jpeg,https://www.reddit.com/r/MechanicAdvice/comments/1lxak79/verna_adas_issue/
MechanicAdvice,Transmission Issues from Incorrect Fluid? - 2017 Ford F-150 Lariat 3.5L Ecoboost - 171k Miles,"Hello! I am looking for some advice from y'all. I recently started finding that my transmission was slipping during gear changes, and it rapidly turned into revving without acceleration, while I was on the road. I managed to limp to a service shop nearby, where I was told that I would have to take my truck into a transmission shop for servicing because the transmission oil (while still full, smelled burned/awful). This is for my 2017 Ford F-150 Lariat 3.5L Ecoboost which is at 171k miles.

I've always tried to take good care of my vehicle, but now I'm looking at a possible nightmare scenario of having my only vehicle out of commission, while having to wait two weeks before an opening at the transmission shop (with a $120/day rental), before having to probably have my tranmission rebuilt.

I recalled that - 4 years ago - I had taken my vehicle in to Valvoline for an oil change (we were in the process of moving, so I didn't DIY oil changes for a year or two). The guy at Valvoline indicated that, since I was at >80k miles, a transfer case fluid change was recommended. I believed him and accepted the $79.99 charge. 

Since then, I noticed that my truck was overheating on long inclines (not always, just occasionally) and burning through coolant (quite frequently). There are no signs of coolant in my engine oil, and two pressure tests have shown no leaks in my cooling system. I also pre-emptively replaced my thermostat, and have been more recently considering servicing the turbos (I believe it's likely to be a turbo coolant line leak). But I'm starting to wonder if the transfer case fluid replacement might actually be the cause of the overheating?

When I revisited my service records from 2021, it showed that 12 **units** of Valvoline MaxLife Automatic Transmission Fluid were used for the transfer case fluid change. I am aware that my transmission uses Mercon *ULV* and my transfer case fluid uses Mercon *LV*. What puzzled me was that **12 pints** of ATF was applied to my transfer case, which only holds **1.5 qt**, while my transmission holds **13.1 qt** (according to the manual).

I called Valvoline and spoke to the manager and he said that **12 pints** of ATF was used because they flushed the transfer case before filling it, resulting in wastage (i.e.: more units of fluid used than mere filling). I do not believe this to be standard procedure for a transfer case fluid replacement, since a drain-and-fill process seems to be standard.

What I am worried about is that, perhaps, they had drained my transmission and not my transfer case, and then filled it back with **12 qts** of Valvoline MaxLife ATF, which is not Mercon *ULV*\-rated (only Mercon *LV*), resulting in my transmission's gradual death. Throughout this time, I had never received a check engine light, so I was wondering: Is it possible that the incorrect fluid or process was used? Or am I way off base? What can I do at this point? I am open to accepting that, at 171k miles, my transmission has simply reached the end of its lifespan, but wanted to be certain that there isn't something afoul.

I spoke to the service technician at my current service center and he said that, if an incorrect fluid was used, I would've seen issues within weeks, and certainly not 4 years after. Perhaps what has transpired is simply normal wear-and-tear?",1,2025-07-11 08:29:56,https://www.reddit.com/r/MechanicAdvice/comments/1lx9voa/transmission_issues_from_incorrect_fluid_2017/,https://www.reddit.com/r/MechanicAdvice/comments/1lx9voa/transmission_issues_from_incorrect_fluid_2017/
MechanicAdvice,Clicking near spark plugs,"There’s this clicking near one of my fuel injectors, assuming it’s a common issue but need help diagnosing",1,2025-07-11 08:26:42,https://v.redd.it/daszka9qj9cf1,https://www.reddit.com/r/MechanicAdvice/comments/1lx9sox/clicking_near_spark_plugs/
MechanicAdvice,"Based Off These Pics, What Do You Think Is Leaking?","2004 Hyundai Sonata, 4 cylinder. Noticed oil (or what appears to be oil) accumulated and saturated on the passenger side of my engine bay while I was changing out my spark plugs and ignition coils. 

My valve cover gasket is still in good shape, and the leak appears to be coming from one of these pipes/hoses on the side. With all the build-up, I couldn't distinguish the source. 

I haven't had any issues driving her lately. And I cleaned off the build-up to the best of my ability after taking these (especially off of that wire at the bottom).

(And yes, I know I need to replace my serpentine belt. That's next on the list)",3,2025-07-11 08:20:23,https://www.reddit.com/gallery/1lx9mt9,https://www.reddit.com/r/MechanicAdvice/comments/1lx9mt9/based_off_these_pics_what_do_you_think_is_leaking/
MechanicAdvice,2000 Ford F250 V10,"I bought a used 6.8L this year. Truck was super solid used to be a FL wildlife and game truck. Less than 100k on it 4x4 all that for a pretty solid deal. Drove fine daily for a couple months. I now have white smoke leaking from the front exhaust/y-pipe but not from the tail pipe. Do y'all think I should be looking for a head gasket issue or does this sound like an exhaust issue? It's one of 3 truck I own so I am trying to nip the problem in the bud as cost effectively as possible, don't wanna have to repair more than I need.",1,2025-07-11 07:50:56,https://www.reddit.com/r/MechanicAdvice/comments/1lx8vu3/2000_ford_f250_v10/,https://www.reddit.com/r/MechanicAdvice/comments/1lx8vu3/2000_ford_f250_v10/
MechanicAdvice,2007 F150 5.4L Ground locations,"I am having an issue with fuel related problems on my F150 2007 5.4L. I have a P0191 Code. I had this code before and replaced the Fuel rail sensor, fuel filter, fuel pump driver module, and then finally the fuel pump which fixed it. After a bunch of research I think it is a ground problem but can not seem to find them anywhere. I am looking for ground G103 and G104. It says it is behind the oil pan near or on the bellhousing but I do not have anything near there. I can not find any diagrams of grounds whatsoever. Is there anyway to know which ground is which and the locations of them? ",1,2025-07-11 07:46:32,https://www.reddit.com/r/MechanicAdvice/comments/1lx8ryg/2007_f150_54l_ground_locations/,https://www.reddit.com/r/MechanicAdvice/comments/1lx8ryg/2007_f150_54l_ground_locations/
MechanicAdvice,Mazda 6 2l. 2009. Vent motor? Issue.,"Hey helpful folk.  After buying six months ago I just discovered that this unit was unplugged. It's located behind the glove compartment. Since I  connected it it makes a loud clicking noise on start for 5 or so seconds. I have so, disconnected again.   

Can you tell me what the part is? I'm having a few other electrical problems so I need to get the basics sorted.    

Very many thanks in advance ",1,2025-07-11 07:26:40,https://www.reddit.com/gallery/1lx8ako,https://www.reddit.com/r/MechanicAdvice/comments/1lx8ako/mazda_6_2l_2009_vent_motor_issue/
MechanicAdvice,Worth buying?,"2003 Nissan Xterra,  4-door, Automatic, 2wd. Clean interior no rips or tears, Drives good, new shocks, brakes, upgraded sound system, new plugs wires. Only issue is idol intake valve needs replaced(part included)
 Seller Only asking $1000 ",1,2025-07-11 07:23:15,https://www.reddit.com/r/MechanicAdvice/comments/1lx87lp/worth_buying/,https://www.reddit.com/r/MechanicAdvice/comments/1lx87lp/worth_buying/
MechanicAdvice,2017 Audi A6 - Sudden Complete Coolant Loss (Twice) - No Warning Signs While Driving,"Vehicle: 2017 Audi A6

Issue: This has happened twice now, 2 months apart. I drive normally with no temperature warnings, no low coolant alerts, no performance issues. Park the car, everything seems fine. Next morning I start the car and get a low coolant warning - check the reservoir and it’s completely empty.

Timeline:
	•	First time: Filled reservoir, car ran perfectly for 2 months with stable coolant levels
	•	Second time: Same exact scenario - drove fine, parked overnight, woke up to empty coolant
Key details:
	•	No gradual coolant loss - I check levels regularly and it stays full until suddenly it’s completely gone
	•	No visible puddles under the car
	•	No overheating while driving
	•	No white smoke from exhaust
	•	No performance issues
	•	Coolant loss appears to happen after parking/shutdown, not while driving

What could cause sudden, complete coolant loss overnight with no warning signs during operation? Looking for potential diagnoses before I take it to a shop. The fact that it’s happened twice with the identical pattern has me concerned about a specific failure mode.

Thanks in advance for any insights!",1,2025-07-11 06:58:33,https://www.reddit.com/r/MechanicAdvice/comments/1lx7lul/2017_audi_a6_sudden_complete_coolant_loss_twice/,https://www.reddit.com/r/MechanicAdvice/comments/1lx7lul/2017_audi_a6_sudden_complete_coolant_loss_twice/
MechanicAdvice,MINI Strut Mounts (repeat failure),"Hello, I have a 2004 MINI Cooper S JCW. I bought it a few months ago and it needed a total suspension refresh. My shop replaced the front control arm bushings and I replaced all of the original struts with Koni Special Actives, along with new OEM bumpstops, spring pads, strut mounts, etc. 

The strut towers were slightly mushroomed so I hammered them back into shape and installed reinforcement plates on top. Then my shop aligned the car. With less than 50 miles on the new setup, the mounts showed evidence of failure, with the rubber stretching out and the bearing bulging upward. Those were Lemforder mounts (supposedly OEM supplier). 

Long story short, I’ve now tried three sets of mounts (two sets of aftermarket ECS “heavy duty” mounts after the Lemforder failure), new aftermarket springs (stock height) in addition to the original coil springs, and a second set of Koni struts. The result has been the same each time, with the stretched, bulging mounts. The dust caps are starting to push up through the opening of the strut towers. I know I have assembled everything in the correct order and torqued to spec. 

I am also getting a slight vibration through the steering wheel above 60mph, and hearing a “pop” over small bumps, below 20mph - I think mainly from the right side. It sounds more like a metal flexing sound than a clunk. I haven’t gotten a chance to check things like the tie rod ends yet, and have new sway bar end links on order, although I didn’t notice any play last time I had it apart. 

What could I be missing here with these strut mounts? It’s understandable for the rubber to flex upward slightly, and these mounts are known to eventually have a clean break in the rubber around the bearing, but they should not look like this. My last resort is to install all metal camber plates but I question if that’s a bandaid fix for an underlying issue. ",3,2025-07-11 06:48:18,https://www.reddit.com/gallery/1lx7dil,https://www.reddit.com/r/MechanicAdvice/comments/1lx7dil/mini_strut_mounts_repeat_failure/
MechanicAdvice,Overheating Issues,"Im at a loss. Ive had the clutch fan and the entire heater assembly changed and yet the car (Ford Expedition 2008) is still overheating-only when the AC is running. What else could it possibly be 😭😭
EDITED to mention that all work is done by a mechanic-not me. Also, when it starts (before it shows it’s overheating) it’ll start sputtering and acting like it’s running out of gas-then it’ll start overheating and if I don’t stop it quick enough, it’ll die ",1,2025-07-11 05:59:27,https://www.reddit.com/r/MechanicAdvice/comments/1lx69cc/overheating_issues/,https://www.reddit.com/r/MechanicAdvice/comments/1lx69cc/overheating_issues/
MechanicAdvice,Mazda 6 GH (2010) pedal and stereing wheel slight wobble/shaking and squealing when braking,"Hello, I recently started experiencing the mentioned symptoms on my Mazda 6. I took it to a mechanic and they measured rotors and pads and found nothing too weird, almost asked me why am I even here.

I told them to go ahead and replace front pads and rotors (back rotors and pads are newer and definitely in no need of replacement) just to see if things will improve and they marignally have improved, not completely though. Since we didn’t have time to go into detail as I basically filled in a short timeframe in their schedule,  there was no detailed investigation as we determined I’ll monitor what’s happening and decide from there.

What else could cause these issues? Only other thing that comes to my mind are tyres since these are midrange summer tyres which are 4 year old (2 years on the car rotated with winter tyres).  Car otherwise drives great and brakes fine (in terms of braking power).

Any and all advices and recommendations are appreciated.

",1,2025-07-11 03:47:30,https://www.reddit.com/r/MechanicAdvice/comments/1lx3ozm/mazda_6_gh_2010_pedal_and_stereing_wheel_slight/,https://www.reddit.com/r/MechanicAdvice/comments/1lx3ozm/mazda_6_gh_2010_pedal_and_stereing_wheel_slight/
MechanicAdvice,2017 Volvo S60 T5 Inscription started having trouble with A/C this summer,"Hi all! I have a 2017 Volvo S60 that I love, it drives really nice and the only other major problem I've had since I got it was the music went out but that wasn't a terrible fix (RDAR LOOP). So, the weather started getting into the 80's-90's where I live and of course my AC stops blowing cool air. I took it to my local Volvo dealership because I had my brake pads scheduled there anyway and asked if they could take a look at that as well, they said they did a dye test and found that my condenser has a leak and quoted me $2000 to fix. Out of my budget unless it's an absolute necessity so I took it to my local garage to see if he had any ideas, he claimed that they could not have performed a dye test without recharging the freon which he also claims they did not do, and he said it was a schrader valve that he replaced and recharged my system and charged me $250. About 2 weeks go by and my cool air completely stops again so now I've been driving around just using the fan trying to figure out between my local mechanic what to do, and with my extended warranty (I believe they cover the ac condenser I just have to check in with the dealership). Basically what I'm asking is if anyone has any advice, if some things that I've been told/work that's been done so far doesn't really add up? I'm assuming the warranty would be the best route to go with the dealership, but not sure if I should even bother taking it back to my local mechanic to see what he wants to do next. Thank you for any advice, this has been driving me insane and I have trouble knowing who to fully trust and who's trying to take advantage of me, albeit a bit overtly cautious.",1,2025-07-11 17:24:45,https://www.reddit.com/r/MechanicAdvice/comments/1lxmvur/2017_volvo_s60_t5_inscription_started_having/,https://www.reddit.com/r/MechanicAdvice/comments/1lxmvur/2017_volvo_s60_t5_inscription_started_having/
MechanicAdvice,1999 Hyundai Sonata 2.5 EPFGW G6BV V6 engine,"I drove 90 km from seller home i parked it outside then i started it up again and moved the car inside, in the morning when i was supposed to go take a picture of it, it didnt start, (crank motor cranks, gas pump works because i untightened the commonrail and turned key over and it spilled gas, i checked one plug it was alright, air filter is new i also checked all fuses and changed two burnt out ones under the steering wheel next to the pedals, i charged the battery and tried to start with the charger on as well,) HOWEVER unlike the night before, in the morning when it started and ran for approx 2-3 seconds before it died the guages didnt move at all and thats not usual i hear the engine combust fuel but the guages dont show the engine spinning, its day 2 now, I spent day one trying to unplug clean and replug all the different cables i could access in the engine bay. The car almost always starts running for like a second or two before it gets cut by something. The day i was driving it home it was raining but no unusual noises could be heard and it always started up first try without any delay which lead me to assume its one of two things either the immobilizer wasnt coded with the reserve key which the original owner never used and therefore the car somehow just locked up and now doesnt even wanna start with the original key or the rpm sensor got bitten though by an animal at midnight and so now the ecu kills the engine cuz it doesnt know rpms, PLEASE HELP ME god or anyone else PLEASEE i bought it drove 90 km from the seller home and no problems, it waited over night and now it doesnt run for more than 2 seconds ( sometimes a little more sometimes a little less ) depends on which key i use, M-Masterkey doesnt let it run for as long as the S-Secondary key which the original owner always used. I dont know what to do im 18 and my parents told me dont buy old car its gonna have problems, but i never expected it to have problems this fast or this instantly...[Video of starting with S - Secondary key](https://youtu.be/Duq0WmlvZwA?si=Id2uBTb8tjR7hPuM)",1,2025-07-11 04:58:47,https://www.reddit.com/r/MechanicAdvice/comments/1lx4zuh/1999_hyundai_sonata_25_epfgw_g6bv_v6_engine/,https://www.reddit.com/r/MechanicAdvice/comments/1lx4zuh/1999_hyundai_sonata_25_epfgw_g6bv_v6_engine/
MechanicAdvice,Reliable Logbook Service SOR,"Looking for recommendations for a cheap but reliable mechanic to do a Logbook Service. As a woman, I don't want to get ripped off by some clown! I'm in Perth South of the River and got a 10 yr old Hyundai i20",1,2025-07-12 00:34:26,https://www.reddit.com/r/MechanicAdvice/comments/1lxungg/reliable_logbook_service_sor/,https://www.reddit.com/r/MechanicAdvice/comments/1lxungg/reliable_logbook_service_sor/
