subreddit,title,selftext,score,created_utc,url,permalink
rivian,Icon Question,So didn’t see this exact icon in the manual. Could have missed it in the 400+ pages. The 12V battery icon looks different in the manual but ChatGPT thinks that is what it is. I did a hard reset and it went away.  But now worried the 12V is going bad (Rivian proactively replaced it in May after 18 months of having no issues).  Thoughts?,3,2025-07-11 19:34:54,https://i.redd.it/ltb9wpsyuccf1.jpeg,https://www.reddit.com/r/Rivian/comments/1lxpgxg/icon_question/
rivian,Tire replacement. Issues at Costco.,"I’m at about 14K miles on the factory Pirelli 22"" tires on my R1S, and they’re already due for replacement, which I know isn’t surprising, since many of us have experienced how short-lived these OEM tires can be.

Today, I got a quote from America's Tire for a set of Michelin Defenders (22""), which seem to be the most commonly recommended replacement in this group. While I was at Costco, I figured I’d swing by their tire center to see if they’d beat the quote, since America’s Tire mentioned they offer price matching.

But Costco told me they couldn’t install the Michelin Defenders because my door jam label specifies ""HL"" for Heavy Load, meaning I’m limited to tires like the Pirellis that meet that rating.

Has anyone else run into this issue? Were you able to find a workaround or an alternative HL-rated tire?",10,2025-07-11 17:50:55,https://www.reddit.com/r/Rivian/comments/1lxnese/tire_replacement_issues_at_costco/,https://www.reddit.com/r/Rivian/comments/1lxnese/tire_replacement_issues_at_costco/
rivian,Tesla charger issues?,"The past few times I’ve tried charging at a public Tesla supercharger, I’ve had nothing but issues. Currently, I’m sitting at the only one in the area while it says “starting” with a circling wheel for 10 minutes and losing battery. Tesla issue, or my car issue? No problem at non-Tesla branded chargers and no issue at home with my Tesla branded charger w/converter",2,2025-07-11 14:24:12,https://www.reddit.com/r/Rivian/comments/1lxiuds/tesla_charger_issues/,https://www.reddit.com/r/Rivian/comments/1lxiuds/tesla_charger_issues/
rivian,Vibration and humming noise from the front end,"I have a late 2022 R1T (11/22 build date) with 37k miles. Rivian SC replaced my front axles and hubs/bearings about a month ago. When I picked it up I started hearing a hollow humming noise from my front end (feels like front left wheel). I've had them look at it last week and they said everything is fine and that it must be my ""aftermarket"" tires (brand new 21"" Michelin Defenders). They seem to be unwilling to diagnose it further unless I put Pirellis back on there. It's mostly noticeable at high speeds but now that I've tuned into it I hear it at lower speed as well. Jumping on the freeway today it has gotten louder, I'll try and record a video clip.

Has anybody had an issue like this before?",2,2025-07-11 13:58:28,https://www.reddit.com/r/Rivian/comments/1lxi7q7/vibration_and_humming_noise_from_the_front_end/,https://www.reddit.com/r/Rivian/comments/1lxi7q7/vibration_and_humming_noise_from_the_front_end/
rivian,Left side Prox Sensors,"I have recently been getting the left side prox sensor going off every time I make a left turn at low speed. This wasn’t an issue till recently, maybe after the last update. Happens at about 15mph or less with about half left steer to full left steer. Video to detail. Anyone else have this issue and a solution. Or is this bug in the software. I have washed the truck 3 times and it continues to happen dirty or clean. It’s absolutely annoying. 

2024 Dual STD Performance 
",4,2025-07-11 12:47:27,https://v.redd.it/bx7gpws9uacf1,https://www.reddit.com/r/Rivian/comments/1lxggu2/left_side_prox_sensors/
rivian,Apple Music Issues,"So this morning while driving into work, I found the Apple Music app had an error and signed me out. I finally hit a stopping point and tried logging back in only to get a “Subscription Not Found” message after successfully scanning the QR code on my phone. I tried  reset and same thing. I know my Apple Music account subscription is there because I’m listening to it now on my phone. I swear this infotainment is gonna drive me nuts but am I missing a step here in troubleshooting? Anyone else having issues today?",1,2025-07-11 07:28:19,https://www.reddit.com/r/Rivian/comments/1lx8c0w/apple_music_issues/,https://www.reddit.com/r/Rivian/comments/1lx8c0w/apple_music_issues/
rivian,DC to Austin: Days 2 and 3,"Day 1 DC to Knoxville:
https://www.reddit.com/r/Rivian/s/2JNwYhttux

Day 2: Knoxville to Bryant, AK
We stayed over night in downtown Knoxville which was great. A public parking lot down the street from our hotel offered free L2 charging and parking over night was only $2! The best charging deal we saw the whole trip.

Chargers are plentiful in TN, but thin out a lot in AK. We hit Tesla superchargers at the Crossville, TN Bucc-ee’s and the Casey Jones Museum in Jacksonville, TN. Both worked fine (Crossville had reports of broken Superchargers on PlugShare?), but we went a little rogue parking. We also hit up a charger in Nashville in a parking garage near Party Fowl when we went for lunch. The charger was fine, but the parking lot company (Park Happy LLC) uses text to pay and it didn’t work so we got hit with an $80 parking violation. Their website has a prominent link to dispute parking violation fines, so I’m guessing this is a common issue. I certainly didn’t park happy.

Day 3: Bryant, AK to Austin, TX
We intended to charge overnight at the hotel in Bryant, which we picked because it had chargers. This was a mistake. The hotel chargers are from StaynCharge, which is total garbage. StaynCharge required an app (ugh) and preloading $$ (double ugh). The cost per kWH was outrageous ($0.65–triple ugh). Even though I set up auto load and auto load took more of my money twice, the car stopped charging after my original money limit was hit after only 2 hours of charging (UGHHHH). So we woke up to a mostly uncharged car. Only positive is that the app has an option to refund the auto loaded money.

Luckily, we’d kept the charge high through TN (knowing AK was a bit of a dead zone), so we had enough charge to get somewhere with a functioning charger. But it added time to our trip we’d hoped to avoid.

Once we hit Texarkana, things got better. We stopped in Dallas for a late lunch at the White Rock Alehouse & Brewery (be sure to try Dave’s Perfect Pils) then tried to charge up before hitting the road, but had to skip the first charger because it was full. We scooted down the road to a Tesla supercharger. We also hit up the Bucc-ee’s in temple to was the bugs off before arriving in Austin. It did better than expected LOL, though some bugs remain.

Overall, not too bad. I had a bit of charge anxiety about AK, but our style of stopping frequently (and charging whenever we stopped) worked well. 


",71,2025-07-11 06:20:31,https://www.reddit.com/gallery/1lx6qjp,https://www.reddit.com/r/Rivian/comments/1lx6qjp/dc_to_austin_days_2_and_3/
rivian,Can we talk about route planning in the app?,"So I have a longer trip coming up and I decide to use the app so i can decide on a realistic departure SOC... and somehow the app says that I can travel 112 miles, while only losing 88 miles of range (with no charging stop, checked twice). 

Sooo.. I send the trip to the truck, and it has added a charging stop and when i remove the charge stop to mafch what the app says, I show an arrival range that is a full 31 miles less than what the app says. 

Now, coming from Tesla, I expect (and have seen) software issues, but is it too much to expect the app to be able to do basic arithmetic? ",2,2025-07-11 05:37:39,https://www.reddit.com/r/Rivian/comments/1lx5sik/can_we_talk_about_route_planning_in_the_app/,https://www.reddit.com/r/Rivian/comments/1lx5sik/can_we_talk_about_route_planning_in_the_app/
rivian,Tesla charger issues?,"The past few times I’ve tried charging at a public Tesla supercharger, I’ve had nothing but issues. Currently, I’m sitting at the only one in the area while it says “starting” with a circling wheel for 10 minutes and losing battery. Tesla issue, or my car issue? No problem at non-Tesla branded chargers and no issue at home with my Tesla branded charger w/converter",2,2025-07-11 14:24:12,https://www.reddit.com/r/Rivian/comments/1lxiuds/tesla_charger_issues/,https://www.reddit.com/r/Rivian/comments/1lxiuds/tesla_charger_issues/
electricvehicles,EV Charges at Home but not at Work,"I have a Volvo EV that I normally charge at home with a Level 1 charger. Works great, never any issues. 

I recently decided to charge at work but lately I try 3-4 Level 2 ChargePoint chargers and none of them charge my car. There are other EVs that seem to be charging fine at the other chargers. 

I just brought the car in to get serviced and the dealer didn’t mention any charging issues. 

Any idea of if this is a problem with my car? Or is it a problem with the chargers?",7,2025-07-11 16:37:33,https://www.reddit.com/r/electricvehicles/comments/1lxlvuo/ev_charges_at_home_but_not_at_work/,https://www.reddit.com/r/electricvehicles/comments/1lxlvuo/ev_charges_at_home_but_not_at_work/
electricvehicles,Dog Mode Availability,"I’m not trying to generate a contentious debate here about the use of dog mode. However, I am curious to know if there is a reason more EV manufacturers don’t offer a dog mode similar to Tesla and Rivian? We have a Mercedes Benz EQE SUV and have to use a hack to keep climate control on. It works but not nearly as convenient or reliable actual dog mode. Mercedes Benz software engineers seemingly lied when telling its customer base that dog mode would be implemented in 2025, but now claim they will not offer it. I assume dog mode can’t be a regulatory issue in the U.S. given the availability in Tesla and Rivian. ",16,2025-07-11 15:33:11,https://www.reddit.com/r/electricvehicles/comments/1lxkgbj/dog_mode_availability/,https://www.reddit.com/r/electricvehicles/comments/1lxkgbj/dog_mode_availability/
electricvehicles,"This is mostly directed to WI EV owners, but feel free to share if your state has a similar issue","I started a petition to ask WI lawmakers to reduce the registration fee for EVs. Although I understand that the state needs the taxes associated with fuel to cover road maintenance and stuff, I feel that charging an EV owner 3x as much a regular vehicle owner is punitive and does not encourage EV ownership. If your state has different policies, feel free to share it here as it could give good ideas to WI legislators. Thank you all.

  
p.s.

new here but used to be very active in other threads, so please don't flag me as scammer or phisher. Check my profile history first. If I'm going against the thread policies, I apologize. Thanks

[https://chng.it/CCpdH8ZdJL](https://chng.it/CCpdH8ZdJL)",39,2025-07-11 14:35:52,https://www.reddit.com/r/electricvehicles/comments/1lxj4ha/this_is_mostly_directed_to_wi_ev_owners_but_feel/,https://www.reddit.com/r/electricvehicles/comments/1lxj4ha/this_is_mostly_directed_to_wi_ev_owners_but_feel/
electricvehicles,EV Charges at Home but not at Work,"I have a Volvo EV that I normally charge at home with a Level 1 charger. Works great, never any issues. 

I recently decided to charge at work but lately I try 3-4 Level 2 ChargePoint chargers and none of them charge my car. There are other EVs that seem to be charging fine at the other chargers. 

I just brought the car in to get serviced and the dealer didn’t mention any charging issues. 

Any idea of if this is a problem with my car? Or is it a problem with the chargers?",7,2025-07-11 16:37:33,https://www.reddit.com/r/electricvehicles/comments/1lxlvuo/ev_charges_at_home_but_not_at_work/,https://www.reddit.com/r/electricvehicles/comments/1lxlvuo/ev_charges_at_home_but_not_at_work/
electricvehicles,Dog Mode Availability,"I’m not trying to generate a contentious debate here about the use of dog mode. However, I am curious to know if there is a reason more EV manufacturers don’t offer a dog mode similar to Tesla and Rivian? We have a Mercedes Benz EQE SUV and have to use a hack to keep climate control on. It works but not nearly as convenient or reliable actual dog mode. Mercedes Benz software engineers seemingly lied when telling its customer base that dog mode would be implemented in 2025, but now claim they will not offer it. I assume dog mode can’t be a regulatory issue in the U.S. given the availability in Tesla and Rivian. ",15,2025-07-11 15:33:11,https://www.reddit.com/r/electricvehicles/comments/1lxkgbj/dog_mode_availability/,https://www.reddit.com/r/electricvehicles/comments/1lxkgbj/dog_mode_availability/
CarRepair,"My Mercedes C300, 2015, Sedan 4 Matic, Sport Trim, recently encountered the P0299 Check Engine Code (Need Genuine Opinions)","My Mercedes C300, 2015 has had the turbo replaced and the CCV kit replaced as well. The turbo itself is under warranty. The car has 294,000KMS on engine. Yes, it’s old, but whatever. 

Moreover, randomly the car will drive fine then if I try to push it harder by accelerating hard on runways, it will enter limp mode without a check engine light. The one time the check engine light did come on, I reset the code. If I turn car off then back on and drive it, it’ll have power again as if it’s fine, however, moment I get aggressive with the gas throttle, it tends to enter limp mode without a check engine light always coming on. I never replaced my boost pressure sensor. I noticed my CCV kit when the mechanic installed has broken the rubber piece inside it, so a buddy of mine tried to seal it for me and used strong adhesive, would this be the issue? I attached the image. 

Any help goes a long way. I do plan on getting it diagnosed professionally, just want to see if anyone has any advice cause most mechanics seem to contradict each other and have no real clue what’s really happening. 

Changed:
-Brand new Mercedes Turbo with manufacture warranty on turbo it self not installation cause got installed at private mechanic shop. 
-Brand new CCV kit. 


Curious:
-why car runs fine most times but when I go into sport plus mode and aggressively accelerate it enters that limp mode stage, and the car loses a lot of power as if no more turbo. 
-car is tuned and has an ECU Stage 2 Tune with careless Armytrix down pipe. 

Thanks all for your advice and feedback in advance!




",1,2025-07-11 21:23:24,https://www.reddit.com/gallery/1lxrgza,https://www.reddit.com/r/CarRepair/comments/1lxrgza/my_mercedes_c300_2015_sedan_4_matic_sport_trim/
CarRepair,VW Polo Mk5 2012 (UK) parking sensor issue,"Had this car for 5 and a half years and this is the first time this has happened. Having an issue where the right sensor automatically comes on (max level) when I’m driving or when I’m parked, even though there’s nothing next to me.

Not sure if it’s the front right sensors or the rear right sensors.

It happened randomly 4/5 hours after I got my car washed 6 days ago, and is still happening. It happens at random times. I have to turn my car off then on again for it to stop, then it will happen randomly again. Or sometimes it just stops without me turning my car off, and will then come back on again randomly.

You can see on the dashboard where the sensor indicators are, the left one is on level 1 with an amber colour, but the right one is on max level with flashing red lights.

I’ve wiped all of the sensors with a cloth.

My car doesn’t have a parking sensor off/mute button.

This is what it says in the car handbook:
“Switching the parking distance warning system on and off
• Switching on: Select reverse gear while the ignition is switched on.
• Switching off: Drive forwards faster than approximately 15 km/h (6 - 9 mph).”

I’m driving forwards faster than 10mph and it stays on.

Any ideas?! Thanks.",1,2025-07-11 03:18:54,https://v.redd.it/e1c260ht08cf1,https://www.reddit.com/r/CarRepair/comments/1lx38i8/vw_polo_mk5_2012_uk_parking_sensor_issue/
autorepair,Lucid T-boned,"Dad’s Lucid Air got T-boned at an intersection. Insurance totaled it due to marginal frame damage. He has the option to keep it for the $10k salvage value and asked if I wanted to buy it. He drove it for a few days after the accident and didn’t notice any issues with how it drives. The passenger side doors are jammed shut, and one window needs repair, but the interior on that side is flawless. The car is less than 2 years old with 30k miles on it. Can the passenger doors just be filled with Bondo and painted? I’m fine with them being stuck.",2,2025-07-11 21:24:27,https://i.redd.it/u7uilxciedcf1.jpeg,https://www.reddit.com/r/autorepair/comments/1lxrhmz/lucid_tboned/
autorepair,2014 Dodge Avenger – Overheating/Smoke Issue,"2014 Dodge Avenger – Overheating/Smoke Issue
I think I may have overfilled the oil a few days ago, and today the car overheated and started smoking near the hoses on the right side of the engine. Could the oil overfill be the cause? If I pump out the excess oil, will that solve it?",1,2025-07-11 10:56:08,https://v.redd.it/z75tj7gdaacf1,https://www.reddit.com/r/autorepair/comments/1lxdno1/2014_dodge_avenger_overheatingsmoke_issue/
MechanicAdvice,Replacing Parts Before They Break,"I have a 99 Tacoma. When I bought it the seller said all the parts are original (not maintenance items). Truck is now 26 years old was wondering if I should preemptively slowly replaces some of the parts before they break. 

Parts I’m talking about:

Water Pump
Alternator 
Fan
Radiator 
Hoses
Belts
Starter
Clutch
Diferential service (never dealt with deferential) 
Timing chain? 
Bearings 

Parts I already placed broke or too much movement:


Head gasket
Spark plugs 
Filters
Oil
Struts
Upper lower control arm 
Inner outer tie rod 
Front brakes rotors
Master / slave cylinder 

I get anxiety of vehicle breaking down due to bad experience when I was younger. I got stuck on the freeway for hours. I’m in Arizona and it is hot. Let me know if I missed anything. Also it is getting harder to find the eom parts for these so I also figure I’ll buy them as I find them and save them. 



",1,2025-07-11 15:00:20,https://www.reddit.com/r/MechanicAdvice/comments/1lxjp1k/replacing_parts_before_they_break/,https://www.reddit.com/r/MechanicAdvice/comments/1lxjp1k/replacing_parts_before_they_break/
MechanicAdvice,My 2009 Mazda tribute stalls when slowing down,"First things first. I am a very broke college student. 

The problem is sometimes when I slow down my car stalls. The battery light comes on my dash and no power. It’s only happned so far when I slow down to pull into driveways

I’ve done everything I know. Checked my transmission fluid and oil (changed a few months ago) All good. Cleaned out my air filter and everywhere I could. I tested my battery all good (9 months old). I had a tranny leak repaired January 2025

I may need a new fan belt but other than that I have 0 clue. Any advice appreciated ",1,2025-07-11 09:38:13,https://www.reddit.com/r/MechanicAdvice/comments/1lxbnmf/my_2009_mazda_tribute_stalls_when_slowing_down/,https://www.reddit.com/r/MechanicAdvice/comments/1lxbnmf/my_2009_mazda_tribute_stalls_when_slowing_down/
MechanicAdvice,"AC issue, 2017 Mazda cx3","Where to start with troubleshooting ac issues?  My ac gets cold (74ish) but not as cold as it used to (45ish), seems to blow colder if I'm accelerating.

Not sure if there is a faulty sensor, or compressor. 

Put the dye in the system but no neon anywhere.

Any tips?",1,2025-07-12 01:42:45,https://www.reddit.com/r/MechanicAdvice/comments/1lxvoji/ac_issue_2017_mazda_cx3/,https://www.reddit.com/r/MechanicAdvice/comments/1lxvoji/ac_issue_2017_mazda_cx3/
MechanicAdvice,Nissan Maxima 2010. AC / POWER STEERING TROUBLE,"Hey guys. 

Bought a used Nissan Maxima 2010 recently. 
Got it services and oil checked after buying. Mechanic indicated no major faults. The AC wasn't 100% so had it looked at. 
First long trip abt 200km (2 days after buying),car reached destination without issues, but soon after started having a belt slipping kind of noise (originating somewhere around the left wheel area). The sound was present whenever I turned on the car and would soon go away. 
But after 3 or 4 times (short trips, inside residential area, 1 to 2 kms) the power steering turned off, the sound became permanent and the AC started blowing hot air. 

What do you think can be the issue? 
Power steering is no longer working, all fluids are present in the right amount, tyre pressure is okay. I'm scared of turning it on now. 
All help appreciated.

Edit: The sound sounded like a belt malfunctioning, some Google searching indicated it might be something called a serpentine belt or a related pulley, which may be a shared component. What do you guys think? ",2,2025-07-12 01:32:40,https://www.reddit.com/r/MechanicAdvice/comments/1lxvj51/nissan_maxima_2010_ac_power_steering_trouble/,https://www.reddit.com/r/MechanicAdvice/comments/1lxvj51/nissan_maxima_2010_ac_power_steering_trouble/
MechanicAdvice,Random squealing noise,1995 Mazda Miata 1.8L. Not really sure what’s causing it but I keep getting this random squeal that’ll come up when I’m driving every few minutes. My car is sounding normal and then it just has this weird noise all of a sudden on a off. It comes and goes on its own but I do know that it’s speed dependent. If assume it’s not a belt related issue because of it being a speed dependent issue. It doesn’t change with the rpm’s or when I’m taking turns. It also goes away whenever I’m going maybe less than 20 mph. It just gets worse\faster when I’m going faster. I checked the brake shields to make sure they weren’t touching the rotor and they were fine. I also did check the brakes themselves and didn’t see anything wrong. Any ideas?,1,2025-07-12 00:56:30,https://v.redd.it/3fgs1u28gecf1,https://www.reddit.com/r/MechanicAdvice/comments/1lxuzf5/random_squealing_noise/
MechanicAdvice,Please help tail light issue!,"2006 Kia Spectra – Right Tail Light Keeps Going Out (Electrical Issue?)

I’ve got a 2006 Kia Spectra with about 87k miles. It’s in solid shape overall, but I’ve been dealing with a really frustrating electrical issue. The right tail light keeps going out shortly after it’s replaced.

I’ve taken it to the shop three times. One mechanic said the electrical harness might be going bad — but apparently they don’t make a replacement for this model anymore. Another said it could be my spoiler light pulling too much power, so they disconnected that. But even after that, the tail light keeps going out.

I’m worried about driving around with a light out, but I can’t afford a bunch of pricey electrical work or constant repairs. The car runs fine otherwise, and I’d really like to keep it going without sinking a bunch of money into it.

Is there anything else I should check? Are there workarounds for an old harness like this? Any advice would be really appreciated. I just want a fix that’ll last.
",2,2025-07-11 23:45:35,https://i.redd.it/5d3drtvo3ecf1.jpeg,https://www.reddit.com/r/MechanicAdvice/comments/1lxtvjd/please_help_tail_light_issue/
MechanicAdvice,Idle rpm unstable but in a weird way,"Hi, I've had an issue for some time now on a 2000 Toyota Celica, which is that when the engine is warm, it basically has 2 idle rpms: 750 and 950. It will randomly switch between those two every 15-20 seconds, but is perfectly stable at both. Any idea what might be causing this ?",1,2025-07-11 21:54:08,https://www.reddit.com/r/MechanicAdvice/comments/1lxs0d8/idle_rpm_unstable_but_in_a_weird_way/,https://www.reddit.com/r/MechanicAdvice/comments/1lxs0d8/idle_rpm_unstable_but_in_a_weird_way/
MechanicAdvice,Any ideas what would cause this?,My friends son is working out of state and had this happen. Gauges went haywire and car would not shift and power steering stopped working. Shut the car off and it stopped happening. Any ideas what kind of issue this would be?,1,2025-07-11 21:37:55,https://v.redd.it/2iriv8nwgdcf1,https://www.reddit.com/r/MechanicAdvice/comments/1lxrq9h/any_ideas_what_would_cause_this/
MechanicAdvice,2015 Toyota Corolla only driver door unlocks and locks,My 2015 Toyota Corolla only driver door locks and unlocks with the key including using the button inside.All doors have to be unlocked and locked manually.What could be the cause of this issue?,1,2025-07-11 21:32:34,https://www.reddit.com/r/MechanicAdvice/comments/1lxrms6/2015_toyota_corolla_only_driver_door_unlocks_and/,https://www.reddit.com/r/MechanicAdvice/comments/1lxrms6/2015_toyota_corolla_only_driver_door_unlocks_and/
MechanicAdvice,Can I swap a 21’ trx block into a 18’ challenger,"As title says, I’m looking at buying a 21 Trx block has 18k kms on it.

About my car/ situation.
My car is a 2018 challenger hellcat, has about 15k kms.

I bought it,blew the first motor. 
Ordered a crate block from dodge paid about 21k CAD, blew that up too ran it too lean and won’t be covered under warranty.

So I don’t want to spend another 20k on a block theirs a local TRX block with 18k kms on it and some upgraded work done for about half the price from factory.

Will this work? What if any issues will I encounter? 

- This trx motor is built out to a 376 stock right now as the add shows it was a 10k package, also comes with harness, ecu & tuner for a trx. ",0,2025-07-11 21:29:34,https://www.reddit.com/r/MechanicAdvice/comments/1lxrkw5/can_i_swap_a_21_trx_block_into_a_18_challenger/,https://www.reddit.com/r/MechanicAdvice/comments/1lxrkw5/can_i_swap_a_21_trx_block_into_a_18_challenger/
