subreddit,title,selftext,score,created_utc,url,permalink
MechanicAdvice,Bad Torque Converter or Transmission?,"1999 Honda Accord EX 3.0 

I purchased this vehicle for cheap from a friend, and for the past year, they experienced ongoing transmission issues. While driving, the car jerks and struggles to shift smoothly. More recently, I’ve noticed a loud clunk when shifting into any gear with the brake applied (automatic transmission). The impact is sometimes severe enough to stall the engine.

Additionally, there's a noticeable 1 to 1.5-second delay between selecting a gear and the transmission engaging. During this delay, I can hear a grinding sound, somewhat similar to lightly pressing metal against a bench grinder.

Transmission fluid appears to be in good condition with no burnt smell. I'm currently having difficulty sourcing a used transmission, and I'm wondering if this could be an issue with the torque converter instead.

Any insight or guidance would be greatly appreciated. Thank you in advance for your help",1,2025-07-11 16:08:03,https://www.reddit.com/r/MechanicAdvice/comments/1lxl8bt/bad_torque_converter_or_transmission/,https://www.reddit.com/r/MechanicAdvice/comments/1lxl8bt/bad_torque_converter_or_transmission/
MechanicAdvice,Steering rack - what should I expect in terms of work and cost?,"My 2005 Scion xB (manual) has been making an ugly noise when I turn sharply to the right (does not happen to the left). Took it to my mechanic who said it was an issue with the steering rack. My mechanic doesn’t do those services, so he referred me to Les Schwab.

Mechanic didn’t give me a lot of details so I don’t know exactly what’s wrong with the rack, if it needs replacement vs. repair, or which component(s) would need repair. I worry that if I go in not knowing much I may get upsold and spend more money than necessary, or at the very least I’ll not be prepared for the cost.

Can anyone offer info regarding what I should expect here? Does my description of the problem help at all in figuring out what repairs I might need or what kind of cost I’m looking at? Aside from the noise, there is no stiffness or uneven steering behavior.",1,2025-07-11 16:07:12,https://www.reddit.com/r/MechanicAdvice/comments/1lxl7oa/steering_rack_what_should_i_expect_in_terms_of/,https://www.reddit.com/r/MechanicAdvice/comments/1lxl7oa/steering_rack_what_should_i_expect_in_terms_of/
MechanicAdvice,P0172 code,"I have been getting this code and can’t figure out the issue. I changed the mass air flow sensor and the o2 sensors but it keeps coming back. I have a 2018 Honda civic, it sputters when I accelerate from a stop and whatever is causing the code is causing other lights to go off, my power steering fluid and esp lights will randomly come on and then later when I start the car after a few hours all warning lights including the check engine light are gone. Any advice would be appreciated",1,2025-07-11 16:04:44,https://www.reddit.com/r/MechanicAdvice/comments/1lxl5p6/p0172_code/,https://www.reddit.com/r/MechanicAdvice/comments/1lxl5p6/p0172_code/
MechanicAdvice,Power steering pump issue,,1,2025-07-11 16:02:13,/r/JeepLiberty/comments/1lxl2z0/power_steering_pump_issue/,https://www.reddit.com/r/MechanicAdvice/comments/1lxl3lj/power_steering_pump_issue/
MechanicAdvice,Town and county '05 3.8L,"I have a town and country and it was misfiring in cylinder 2 (p0302) and was also showing code (p0135).
I put in a new Delco upstream O2 sensor (xzz) and changed ignition wires and the coil pack as well as changing the spark plug on cylinder 2. ( Did all of this while out of town and then drove 300 miles back home with no issues.)

I am not getting both lean and Rich codes(p0171 & p0172) as well as the p0406. 

Could this just mean a bad erg valve? Could it cause a all 3 codes...or could these codes indirectly be related to the O2 sensor? I know that sometimes you can unfortunately get a dud but I am just at a loss. 

Any input?",1,2025-07-11 15:45:15,https://www.reddit.com/r/MechanicAdvice/comments/1lxkpsr/town_and_county_05_38l/,https://www.reddit.com/r/MechanicAdvice/comments/1lxkpsr/town_and_county_05_38l/
MechanicAdvice,Blown Motor or Bad CPS?,"2015 ram ecodiesel 3.0

About a month ago, I went to pass someone, truck revved high 3500-4500 rpm’s I passed them with ease then quickly lost all power. Motor was still idling but wouldn’t rev. I coasted to a flat spot off the road and and shut the truck off. While waiting for the tow I started it again, it started but idled very rough, I gave it some throttle it barely moved and sounded awful. I shut it off and had it towed. 

Next day I try to start it, cranked normally but no start. I’ve let it sit now about a month, went out and just for fun went to start it, barely cracks now. Got a brand new battery, same thing cranks exactly 2 revolutions then stops. 

Only dtc code it’s throwing is P061C-00. 

With this information is it likely a blown motor or the cps sensor? 

I’m willing to pull trans and change sensor/ring but want to know if there’s a definitive way to tell if it’s the sensor or motor is trashed. I’ve read they’re bad about cracks going bad, worried this is my issue. ",1,2025-07-11 15:25:19,https://i.redd.it/8beajasfmbcf1.jpeg,https://www.reddit.com/r/MechanicAdvice/comments/1lxk9xz/blown_motor_or_bad_cps/
MechanicAdvice,"2006 Pontiac Grand Prix GXP, 5.3L LS4 - Intermittent Start/Stall Led to Deep Dive - Found No Bank 2 Fuel Trim, ETC Issues. Need Help! Usually able to fix simple stuff myself but after hours in the garage I am begging for mercy.","Hey everyone, seeking guidance from the community on r/MechanicAdvice! My 2006 Pontiac Grand Prix GXP with the 5.3L LS4 is having intermittent start-and-stall issues. Sometimes it starts and runs correctly. Other times, it cranks, catches briefly, and stalls immediately unless the throttle is used. An OBD-II scanner was used for diagnostics.

Diagnostic Data:

1. **Bank 2 Fuel Trims:** Missing Data
   * No data is received for Bank 2 fuel trims (STFT2 and LTFT2) when monitoring live data. The scanner displays them as a dash that does not change through a drive cycle, although the engine seems to be running on Bank 2 (no noticeable misfires), the computer provides no feedback for it.
2. **Bank 1 Fuel Trims: Negative LTFT**
   * LTFT1: \[-10%\]
   * STFT1: \[0%\] (at idle)
   * I found a hole in the intake boot while trying to diagnose this, and assumed I had solved the issue, but I know a lean condition from a vacuum leak should cause positive fuel trims as the computer adds to compensate. The negative LTFT suggests a rich condition on Bank 1.
3. **Throttle Position Discrepancy**
   * A discrepancy between the ""Commanded Throttle Position"" and the ""Actual Throttle Position"" PIDs on the scanner. With the ignition on (engine off), slowly depressing the accelerator pedal shows the ""Actual"" not smoothly or immediately tracking the ""Commanded."" It sometimes lags or is slightly off. I cleaned the throttle body, but it didn't solve this either.

My goal is to fix this with the tools I have. Featuring my mom's cameraman skills.",1,2025-07-11 15:23:02,https://v.redd.it/qeaed1bmlbcf1,https://www.reddit.com/r/MechanicAdvice/comments/1lxk837/2006_pontiac_grand_prix_gxp_53l_ls4_intermittent/
MechanicAdvice,power steering problem,"I have a dodge challenger rt 2013, and power steering is dead, with a code ""u0131"" ""lost communication with power steering column module""

\-the car was connected the battery cables the wrong way and that caused the issue, a lot of electric things stopped working when it happened, but it was fixed except the power steering!

\-i have checked fuses and replaced the electric power steering pump",1,2025-07-11 15:13:29,https://www.reddit.com/r/MechanicAdvice/comments/1lxk04d/power_steering_problem/,https://www.reddit.com/r/MechanicAdvice/comments/1lxk04d/power_steering_problem/
MechanicAdvice,what is this noise?,"i drive a 2012 scion tc and this noise started today, it comes from the center of my car?? i keep my maintenance up to date and have never had issues with it before. ",1,2025-07-11 14:56:21,https://v.redd.it/lz2sxlk5hbcf1,https://www.reddit.com/r/MechanicAdvice/comments/1lxjlot/what_is_this_noise/
MechanicAdvice,Any guesses on what the problem could be?,"Howdy y’all. A few months ago I purchased a 2016 Hyundai Veloster R-spec with a 1.6l 4cyl engine sitting at 76k miles. I know, I should have done my research before buying a Hyundai, it was my first time buying a car and what’s done is done. 
Recently I went on a trip out of town, and after about 90 minutes of driving, as I was on the highway my AC cut off. I didn’t know this was a warning sign and kept driving, and 15 minutes later the car wouldn’t get any gas. It shifted gears fine, but the rpms dropped to zero and it wouldn’t accelerate. I had to roll off the highway, and once I stopped the car it turned off and wouldn’t turn back on. The lights come on but the car makes a kind of wheezing/whirring noise.
This issue came out of nowhere, when I bought the car there was proper maintenance history and no damage, and I have only put 2,600 additional miles on the vehicle. My check engine light did turn on about a month ago, but the DTC was P0299 and at the time I couldn’t spend any money on resolving it.
I got the car towed to a mechanic who said my engine is “completely burnt up and in need of replacement. They quoted me a minimum 8k (not including labor) for a used engine with 90k miles. This is extremely suspicious to me and I will be visiting another mechanic for a second opinion, but I thought I would see if anyone has a clue about what this could mean before I pay for another tow. Thanks!",1,2025-07-11 14:54:21,https://v.redd.it/tfndze9wgbcf1,https://www.reddit.com/r/MechanicAdvice/comments/1lxjk4a/any_guesses_on_what_the_problem_could_be/
MechanicAdvice,2017 ford escape manual lift gate issue,When I close the lift gate it will latch shut but doesnt seat all the way down and the vehicle says its still open and it will not lock. I changed the actuator and the problem persists. Any idea of what I should check or try next?,1,2025-07-11 14:42:58,https://www.reddit.com/r/MechanicAdvice/comments/1lxjak1/2017_ford_escape_manual_lift_gate_issue/,https://www.reddit.com/r/MechanicAdvice/comments/1lxjak1/2017_ford_escape_manual_lift_gate_issue/
MechanicAdvice,Could this crack cause my car be be loud while accelerating,"Could this crack cause my car be be loud while accelerating ? For a little bit of background info my car is a 2015 VW Jetta with 180k miles and is already having several other mechanical issues .I was wondering if I could slap some jb weld on this to fix the loud noise issue

I’m aware this wouldn’t be a great solution but I just want to make this car last a few months at the most. I was hoping to be able to afford to pay cash for a new used car while not pouring too much into my current  junker.",16,2025-07-11 14:42:26,https://i.redd.it/zrztmo0sebcf1.jpeg,https://www.reddit.com/r/MechanicAdvice/comments/1lxja4c/could_this_crack_cause_my_car_be_be_loud_while/
MechanicAdvice,O2 sensor 2014 Jeep JK 3.6L V6 issue,Popping a P0132 and P1128 code on my jeep. Bank 1 Sensor 1 issue. Having the hardest time finding a replacement for the correct sensor. I’ve seen Mopar and NTK are the brands to go with. Obviously OEM and NTK being close to OEM. But can’t seem to source that part. Any links or part numbers would be greatly appreciated. ,1,2025-07-11 14:13:42,https://www.reddit.com/r/MechanicAdvice/comments/1lxil75/o2_sensor_2014_jeep_jk_36l_v6_issue/,https://www.reddit.com/r/MechanicAdvice/comments/1lxil75/o2_sensor_2014_jeep_jk_36l_v6_issue/
MechanicAdvice,2008 Acura RDX - Oil leak saga continues,"2008 Acura rdx has 198,500 miles. Been hunting down oil leaks non-stop. Valve cover gasket was just replaced with an OEM, pressure sensor was replaced, oil change about 2,000 mi ago so I will be doing one again soon.

This looks like a gasket issue between the oil filter housing and pan on the left and then another leak above the housing. Any thoughts? This is a screenshot from a video I took so the quality isn’t the best.",2,2025-07-11 14:07:45,https://i.redd.it/plijvlnl8bcf1.jpeg,https://www.reddit.com/r/MechanicAdvice/comments/1lxig1o/2008_acura_rdx_oil_leak_saga_continues/
MechanicAdvice,ABS and VSC on 07 Camry!!,"ok reddit i need your help!!

i drive a 2007 Camry xle, its in pretty good condition, no accidents, new battery,  relatively new breaks and sparks, clean v6 engine at only 100k miles. and its been **pretty much** fine accept earlier today. 

after idling for maybe 5 mins i turned my car off and sat there for a another 5 or so, and then tried to start my car to leave and it barely cranked but no flip, all the dash lights came on for a second and then just the abs and vsc light stayed on and the warning screen said "" check vsc system"" . its and push to start if that helps at all. the ac got a little louder before i turned the car off but i didn't think it was concerning. i tried a second time and the breaks got stiff. so i called for a jump and it was fine after that. its done this and something similar twice before. 

once a little less than 2 and a half months ago, i was dropping my sister off and same thing i sat in the parking lot for a second, probably only 1 or 2 mins and then turned the car off. then when i went to start it it cranked for a second and then died, same lights came on. i tried a second time that time as well, the dash flickered on and off like it didn't even have enough power for that, or just couldn't fully turn the lights on and then died. i jumped it, started fine, lights went off, i tested the battery at it was just over 12v, and thats all she wrote.

  
until about two weeks ago. i was driving my mom and we pulled off on the side of the road for directions. same thing. i sat there for about 2 mins but this time i only got a ding, like your seatbelt ding, but only once. i looked at the dash and didn't see anything, then 30 seconds maybe a minuet later same ding and the vsc light just flashed, maybe 5-10 seconds if that then the light disappeared. it did it 2 more times while we were figuring out what to do and then we just headed home. no issues driving or anything, i think we had the ac on again but neither of us remember. after that no issue until today.

  
my abs and vsc systems work fine, ive recently had to slam my breaks and i felt the abs kick on. all my fluids are good, oil is still good, gas cap clicks and is tight, temps and rpm are fine. haven't checked the fuses or any of my censors but nothing else has trouble. i really have no idea what it could be. ",1,2025-07-11 14:06:30,https://www.reddit.com/r/MechanicAdvice/comments/1lxiez1/abs_and_vsc_on_07_camry/,https://www.reddit.com/r/MechanicAdvice/comments/1lxiez1/abs_and_vsc_on_07_camry/
MechanicAdvice,2012 328i multiple issues,,1,2025-07-11 14:02:16,/r/BmwTech/comments/1lxib2a/2012_328i_multiple_issues/,https://www.reddit.com/r/MechanicAdvice/comments/1lxib76/2012_328i_multiple_issues/
MechanicAdvice,2013 Elantra GL 1.8L: Crank with no start when hot,"Yay! More Elantra issues!

I have a 2013 Elantra 1.8L (126XXX km)  that within the last two weeks has taken to the following:

1. On a cold start, it will crank, start, then immediately the engine cuts out (stalls?). This is intermittent. Usually when it happens, it will crank, fire, and start as normal on the second go.
2. On a warm-hot start (ie, drive for 15-20+min, then stop the engine and restart) it will crank and crank and crank and crank and not fire. If I let the engine sit for 5-10 minutes, it'll usually fire up fine again.

  
I have scoured the web for causes, and so far I have changed the spark plugs (unrelated, but I was going to do them anyway) and changed the crankshaft position sensor. Once I changed the crank sensor, the problem went away for a couple days and now it's back.

My thoughts: We're getting air, fuel, and spark. When I turn the key to acc, I can hear the buzz of the fuel pump priming. When it is cranking and not firing, I tried turning the key on and off of acc to prime the fuel pump further, but that did not help. Spark, well, I just changed the plugs. Air, I just cleaned out the engine air filter and noticed some carbon around the throttle body, so cleaning that is on my to-do, but I don't suspect that it's causing this. When the car runs, there's no hesitation or lag; I can redline it fine and it never seems to hesitate as though it was starved for one of the three. This said, I think it may be a synchronization issue between engine and computer (ie, crank / cam sensor is borked therefore computer is not letting the injectors fire because it thinks the cam isn't clocked correctly?)

  
After changing the crank sensor, it idles a lot better - it would 'hiccup' (?) when warm and idling, going from \~800 to \~1200 RPM and then settling back down to \~800. Now it idles around \~650 and doesn't fluctuate significantly. Off topic but my gas mileage went down from \~8 to \~7 L/100km after changing the crank sensor and the spark plugs. Nice!

  
My next steps (in order of doing the easiest shit first) is changing the cam sensor, and then maybe changing the fuel pump + filter assembly. I'm not sold on it being a fuel delivery issue though.

  
What are your thoughts? I am so microscopically close to selling this goddamn car as I've already had to get the lower block replace due to the piston slap issues that they have..

",1,2025-07-11 13:47:09,https://www.reddit.com/r/MechanicAdvice/comments/1lxhxr3/2013_elantra_gl_18l_crank_with_no_start_when_hot/,https://www.reddit.com/r/MechanicAdvice/comments/1lxhxr3/2013_elantra_gl_18l_crank_with_no_start_when_hot/
MechanicAdvice,Window Issue,"Hi,

Recently having a problem with my wife’s car, drivers side window will go down, then will come back up maybe a few centimetres then the motor stops. I have to turn the ignition off and then back on to get it to move another few centimetres. Have to do the on off cycle for quite some time to get it back up. Usually only happens on colder mornings.

Any ideas? ",1,2025-07-11 13:36:53,https://www.reddit.com/r/MechanicAdvice/comments/1lxhonu/window_issue/,https://www.reddit.com/r/MechanicAdvice/comments/1lxhonu/window_issue/
MechanicAdvice,Hyundai Tucson 2021- Brake Pads,"Hello Experts!

I am at 58k miles on my hyundai tucson 2021. And perfectly no issues as of  now but whenever I go to brake plus or Midas or any other corporate chain store, they intend me to change the Brake pads & Rotors and gives me a quote of $1200 bucks. So I have decided to change them myself.

Im shopping on Rockauto for brakepads but I only find front pads from Akebono but the rear are not available. Is it still ok to get front pads from Akebono and Rear pads from Bosch? Would that be ok or is it recommended to be from same brand for both axles?",1,2025-07-11 13:34:34,https://www.reddit.com/r/MechanicAdvice/comments/1lxhmmo/hyundai_tucson_2021_brake_pads/,https://www.reddit.com/r/MechanicAdvice/comments/1lxhmmo/hyundai_tucson_2021_brake_pads/
MechanicAdvice,"Looking for advice to narrow down an issue regarding a 2018 Mazda three AC works great whenever driving but after a few minutes when stopped, it begins to blow hot. The condenser is not in the best shape, but I don’t think it is the main issue here.",,1,2025-07-11 13:27:54,https://www.reddit.com/r/MechanicAdvice/comments/1lxhgq7/looking_for_advice_to_narrow_down_an_issue/,https://www.reddit.com/r/MechanicAdvice/comments/1lxhgq7/looking_for_advice_to_narrow_down_an_issue/
MechanicAdvice,Mechanic sent me off with 2 misfiring cylinders and a quest…,"I was driving my way out of Florida yesterday when my 2000 Chevy Express 2500 5.0L V8 check engine light started blinking and I could feel misfiring. I crawled over to the nearest mechanic a few miles off of I-95 and was lucky that a shop was willing to take me in immediately and help me get back on the road. OBD2 scanner showed 4 misfiring cylinders and their diagnosis was to replace the spark plugs and wires. A few hours and $400 later, 2 cylinders are still misfiring. 

He told me to go to the nearest auto part store, get some Cataclean, continue my trip and run through the rest of my tank like a demon, top off with high octane fuel and Lucas Deep Clean, and my problems will magically resolve. 

I’m in Atlanta now, 500 miles later, still misfiring, and am worried about my catalytic converter. How do y’all feel about this mechanics advice and what should I do now? Misfiring is worse at idling and low speeds, I seem to have an issue with air/fuel ratio (running rich possibly), he mentioned something about the oxygen sensors and fuel injectors on his computer. I’m supposed to be in Ohio by Wednesday and it’s now the weekend… thanks",1,2025-07-11 13:27:04,https://www.reddit.com/r/MechanicAdvice/comments/1lxhg15/mechanic_sent_me_off_with_2_misfiring_cylinders/,https://www.reddit.com/r/MechanicAdvice/comments/1lxhg15/mechanic_sent_me_off_with_2_misfiring_cylinders/
MechanicAdvice,Help needed for car rookie,"Hi everyone, a few issues have surfaced with my car the past few days (2013 Ford KA). I first noticed a whistling/screeching noise when driving at speed down the motorway. It’s intermittent and only seems to happen when on fast roads. Then as I was driving home today I was idling in traffic and the whole car started to rumble, it sort of felt like the fan was working overtime. It may have been because I was overly aware but it felt like I was struggling to get my speed up as well as some slight juddering in lower gears. I thought it might be the spark plugs but can’t see how that links to the earlier issue of the screeching noise. 
It has also been SUPER hot this past week so I’m going to get some coolant tomorrow in case the tank is running dry as I thought that might be causing it. 
If anyone has any ideas it would be super appreciated, I guess I’ll try and get to a mechanic next week but know it will be hard to diagnose without any warning lights! ",1,2025-07-11 13:21:41,https://www.reddit.com/r/MechanicAdvice/comments/1lxhbds/help_needed_for_car_rookie/,https://www.reddit.com/r/MechanicAdvice/comments/1lxhbds/help_needed_for_car_rookie/
MechanicAdvice,Is it possible for a strut to be un fixable?,My 2013 Chevy impala LTZ driver rear strut broke. I took it to a mechanic and they said it’s completely broken and the area it attaches to the car is rusted out. I asked if they could fix it and they told me it was unfixable. I’ve never heard of a strut being unfixable and that because of the broken strut I shouldn’t drive it. I should also note that they do sell vehicles there as well. Is this issue truly not fixable or were they just trying to freak me out to get me to possible buy one of their vehicles?,1,2025-07-11 13:03:15,https://www.reddit.com/r/MechanicAdvice/comments/1lxguyo/is_it_possible_for_a_strut_to_be_un_fixable/,https://www.reddit.com/r/MechanicAdvice/comments/1lxguyo/is_it_possible_for_a_strut_to_be_un_fixable/
MechanicAdvice,At my wit's end with this 62te,"So to preface, this is a project I'm helping with, and it's been going on for a bit longer than expected. So we have a 2012 Ford Dodge grand caravan with error code P0733 and the only issue is that we lose so nearly all speed going into 3rd gear. There were other codes but we've resolved those.

We've done basically everything but replace the entire transmission, changed the solenoid, opened up the new solenoid since one of the springs inside were stuck and made sure the lil ball thingies were free and even opened up the old solenoid to see there wasn't anything wrong. 

Also went ahead and changed all the sensors and changed the oil multiple times. All the wires were tested and working. We haven't fully taken the transmission out as we currently don't have the space to do that, but this is our next step and would to at least get an idea of what to do/look for once we get to that point. (I honestly want to just cut our losses, but not my choice to make.) If it turns out we need a new transmission, that'll be the straw that broke the camel's back n we finally get rid of this car lol.",1,2025-07-11 12:29:12,https://www.reddit.com/r/MechanicAdvice/comments/1lxg0lu/at_my_wits_end_with_this_62te/,https://www.reddit.com/r/MechanicAdvice/comments/1lxg0lu/at_my_wits_end_with_this_62te/
MechanicAdvice,Both ABS and Traction lights are on,"2017 Hyundai Sonata i went on vacation for 2 and a half weeks, came back yesterday, car drove completely fine, no problems and drove over 3 hours total with no issues. This morning i turned my car on and both those lights came on. What could be the issue? Can i still drive my car for a couple days since i have work?",1,2025-07-11 12:09:28,https://i.redd.it/2r2iq0whnacf1.jpeg,https://www.reddit.com/r/MechanicAdvice/comments/1lxfivn/both_abs_and_traction_lights_are_on/
