subreddit,title,selftext,score,created_utc,url,permalink
MechanicAdvice,1998 Chevy S10 codes,"My S10 has a P0753 (Shift Solenoid ""A"" Electrical malfunction) and a P0741 (Torque Converter Clutch (TCC) Circuit Performance or Stuck Off). When driving, it slips very bad going into the gears, but the gears do still engage and work, including reverse. What should I look at replacing/fixing to solve this issue?",1,2025-07-11 21:14:42,https://www.reddit.com/r/MechanicAdvice/comments/1lxrbbq/1998_chevy_s10_codes/,https://www.reddit.com/r/MechanicAdvice/comments/1lxrbbq/1998_chevy_s10_codes/
MechanicAdvice,Need advice for bad ram top end,"So as the title states I have a bad top end in my 2014 ram 1500 this is also known has a hemi tick it comes from multiple issues such as mds and bad oil pressure. However I developed the tic over 2 years ago however in the couple of months it has worsened as my code reader says 2 other cylinders are misfiring and my motors is now running worse like to the point it shuts off at high speeds when I hit the breaks. So now I’m just wondering what to do it cost like 4,000 to fix which I don’t have nor could save up an I’m worried doing it myself could mess something up. Advice?",1,2025-07-11 21:09:18,https://www.reddit.com/r/MechanicAdvice/comments/1lxr7p9/need_advice_for_bad_ram_top_end/,https://www.reddit.com/r/MechanicAdvice/comments/1lxr7p9/need_advice_for_bad_ram_top_end/
MechanicAdvice,2004 F150 | 5.4L Triton,"My truck has been messed up. It is a 2004 F150 Lariat King Ranch Edition RWD with a 5.4 L Triton engine (I know, these things have issues) with 220k miles.
  
Si far, I have replaced the spark plugs, starter, fuel injectors, ignition coils, fuel filter, fuel pump, MAF sensor, O2 sensors, and smoke tested for any leaks. It has codes for system being too rich and too lean. I have recently had worse issues with it.  
  
Today I had a new issue. You can hear the noise in the video, the entire truck shakes while it does that. I was pulsing the gass in the video so it could be heard better. It barely wants to go from 0-20 and puts off an awful smell when doing so, I dont recognize the smell as I have never had a vehicle this messed up. The low oil pressure warning occasionally kicks on. The truck shut off two times today. I was on my way to my brother's house and the battery light came on and engine shut off. I just started it back and there was no issue. When leaving, I came to a turn and it shut off while I was turning and I did the same thing. I droce it home and just didn't stop for anything and it made it back. I dont really want to start it again without any guidance, as I am not really sure what is wrong.  
  
I can replace things and do fine with mechanic work, but I only know a lot about the things that I have already done. My next plans were to change the cam sensors and egr valve. If that does nothing then I'll bite the bullet and replace the timing chain.  
  
Guidance would be much appreciated. Would I be best off selling the hunk of junk and trying to buy something new? It obviously wont sell for a lot and I can't afford anything that isn’t going to have problems, so I dont want to fully reset since I have already done some work on it. I did not do proper research on the engine before buying the truck, lesson learned.",1,2025-07-11 21:04:09,https://v.redd.it/10v9hivvadcf1,https://www.reddit.com/r/MechanicAdvice/comments/1lxr4do/2004_f150_54l_triton/
MechanicAdvice,Estimated cost A/C - Advice,"Hello, I’m purchasing a truck soon and I’m doing it within a strict budget, is a 97 ford ranger with a v6 3.0 . Seller claims the a/c is out and could be a leak, i wanted to know how much could I expect to cost me a vacuum and recharge at a shop since I already has the experience with my car trying to do the recharge with the cans that are sold at Walmart that comes with the gauge, didn’t work because the ac on my car has gotten air so I do not want to toss the 40$ that cost that can and have the same issue. I’m already planning replacing all the fluids (oil, transmission and coolant) before hitting the road on it. It would be more appreciate it if y’all uses big chains ( ex: brake plus, jiffy lube’s) and if anyone has any experience with the same vehicle and can let me know what should I be aware when checking on it. Thanks in advance  ",1,2025-07-11 20:54:53,https://www.reddit.com/r/MechanicAdvice/comments/1lxqy5c/estimated_cost_ac_advice/,https://www.reddit.com/r/MechanicAdvice/comments/1lxqy5c/estimated_cost_ac_advice/
MechanicAdvice,Blown Head Gasket Tips?,"So, I drive a 2010 Toyota Matrix, 2.4L with about 220k miles on it. Unfortunately my head gasket is starting to fail and I am nowhere near equipped with the $900-$1500 to get that repair done. I am well aware that driving like this is guaranteed to cause permanent engine damage eventually. I'm looking for tips from ya'll to help prolong the death of my engine as long as possible while I make ends meet for a new vehicle. Any and all tips appreciated, I'm young and new to a lot of these issues. Thank you in advance to anyone who has advice. :)",1,2025-07-11 20:37:16,https://www.reddit.com/r/MechanicAdvice/comments/1lxqmk2/blown_head_gasket_tips/,https://www.reddit.com/r/MechanicAdvice/comments/1lxqmk2/blown_head_gasket_tips/
MechanicAdvice,Honda CRV 2006,"Hi guys,

Looking to purchase a 2006 Honda crv. Just viewed this one today.
I also know that there has been two new owners over the past month. I will ask them about it if im sure on purchasing it.
I think it's pretty nice and it runs smoothly. Im just unsure about the damage to the front, but wonder what you think about the engine and if it looks in good nick.

Hoping someone can give me some advice. Thanks!",5,2025-07-11 20:33:36,https://www.reddit.com/gallery/1lxqk68,https://www.reddit.com/r/MechanicAdvice/comments/1lxqk68/honda_crv_2006/
MechanicAdvice,2006 MAZDA AXELA 1.5L 5 SPEED MANUAL,"Car used to turn over perfectly and idle without an issue. Tried to replace the Knock sensor and failed to take the intake housing off to reach it. Put everything that i unbolted/took off back, that includes in order, the computer housing/filters, disconnecting the computer/filter housing from the throttle body, unbolting the intake housing and removing a thin and long metal hose from it? (wasn’t sure what this was) and the fuel injectors. 

I put everything back on the same way it came off but i’m worried i knocked something loose or put something back wrong and have done this. There is a video to accompany my explanation here and the issue itself on video. 

I need help diagnosing this to then fix it im stuck. Please help.",1,2025-07-11 19:57:07,https://v.redd.it/sktcz81wxccf1,https://www.reddit.com/r/MechanicAdvice/comments/1lxpvxf/2006_mazda_axela_15l_5_speed_manual/
MechanicAdvice,2017 Cadillac Escalade Steering Issue,"Looking for some help with my 2017 Cadillac Escalade. I’m on my fourth trip to the local dealer and they cannot rectify the issue.

The vehicle steering pulls and does not return to center. They have done four alignments on the vehicle and still not rectify it.

I truly believe this is not a mechanical issue and more an issue with the electric power steering. I have attached a video of my scanner showing they delivered torque value from the steering control module. Turning the vehicle to the right everything seems OK but when I turn the vehicle to the left, the value skyrockets past the expected range. My local Cadillac dealer says this is perfectly normal, which I somehow can’t believe.

I have tested the battery along with insured connections, and grounds are tight. My last resort would be replacing the power steering rack.

Any help or guidance would be truly appreciated.",1,2025-07-11 19:29:42,https://v.redd.it/phg5acu0uccf1,https://www.reddit.com/r/MechanicAdvice/comments/1lxpddw/2017_cadillac_escalade_steering_issue/
MechanicAdvice,2006 Miata noise,I have a 2006 Mazda Miata that is making a noise recently. I was driving on a highway recently and ran something over that popped up after the truck in front of me hit it. My AC hasn’t been working since. Any ideas if this is an engine issue?,1,2025-07-11 19:14:01,https://v.redd.it/yi9c04c7rccf1,https://www.reddit.com/r/MechanicAdvice/comments/1lxp2m6/2006_miata_noise/
MechanicAdvice,2003 Sienna...ABS light and pressure light on. Advice please,"Hello,

My father has a 2003 Toyota Sienna. Awhile ago the ABS and tir e pressure sensor light came on. He recently took the car to a mechanic and they tried to change a sensor on one of the wheels but that didn't make any difference so they put the old one back on. They told him their computer says the car is going 60mph while the car was in park and he needs to take it to a dealer to get looked at since they didn't know how to fix that. 

My father says the car drives fine, but I'm wondering is it safe to drive in that case? He made an appointment with the dealer but its a couple weeks out. 

Any thoughts on if the car is safe to drive as well as what could be the issue would be appreciated!

  
Thank you in advance!",1,2025-07-11 19:11:05,https://www.reddit.com/r/MechanicAdvice/comments/1lxp0lh/2003_siennaabs_light_and_pressure_light_on_advice/,https://www.reddit.com/r/MechanicAdvice/comments/1lxp0lh/2003_siennaabs_light_and_pressure_light_on_advice/
MechanicAdvice,2005 Honda CRV vibrates when in drive with foot on break,"I hit a pothole on my passenger side pretty hard, ever since thin my car has been vibrating while in drive with my foot on the break, not constantly but usually comes up at least once every drive. It only happens in drive with foot on the break, not neutral not reverse

When I originally spoke to a mechanic over the phone they said to take it to Les Schwab first because it most likely has something to do with the suspension or wheel since that's where the impact came from, but they said they was no visible damage or anything wrong with the car from that standpoint (Les Schwab I know)

I then pop the hood and see when I switch gears the engine moves forward and backwards - ChatGPT says this is from a passenger side engine mount failure. I take it to a mechanic and they said they inspected and ""the DRIVER side mount is moving the most"" I'm extremely confused here because all signs point to the passenger side mount (car hit impact, forward backward engine movement) could the problem really be the driver side mount? I'm worried they will get me to pay for it, it won't solve the issue then I end up paying for the next mount....
",3,2025-07-11 19:05:53,https://www.reddit.com/r/MechanicAdvice/comments/1lxox07/2005_honda_crv_vibrates_when_in_drive_with_foot/,https://www.reddit.com/r/MechanicAdvice/comments/1lxox07/2005_honda_crv_vibrates_when_in_drive_with_foot/
MechanicAdvice,"Need advice on 2011 Equinox LT 2.4 ecotech, exhaust manifold.","Long story short my muffler rusted and had to be replaced.  Shop told me that he thinks the manifold is broken but he is unsure if it is the cat and the manifold since he was looking from the vantage point of the muffler.  Vehicle does have oil consumption issues because, Equinox.  I am not a mechanically inclined per say, but can follow step by step instructions.  It is possible that the hubby and I could buy the manifold and tools that we don't have and manage based off the video that I have seen but would take us a couple of days likely to do.  We do still have a loan on the vehicle, which I plan on having paid off within a year or less, so I figure we have 3 options:

Opt 1-  Try changing it out ourselves.  It looks straight forward but time consuming.  We have been mostly successful at various simple jobs like MAF sensor, solenoids, and PCV stuff on cars and lawn mowers.

Opt 2- Call around and find the best price, eat the 400 to 500 labor cost and hope it isn't the cat as well as.  I don't plan on sinking 4 grand into a car worth 5,000.

  
Opt 3- Not fix it and plunk the money down on the loan to pay it off faster, hope that it doesn't croak beforehand.   

We are planning to get another vehicle once this one is paid, (I am sticking to Toyota and Honda and hell with low mileage) and will just run this one until it dies either way and then scrap it.  Not trading that crappy engine in to be sold to another person.  I would just like to be in a better spot financially before we do.   What is my best option?  Roughly how long have I got?",1,2025-07-11 18:41:35,https://www.reddit.com/r/MechanicAdvice/comments/1lxofr3/need_advice_on_2011_equinox_lt_24_ecotech_exhaust/,https://www.reddit.com/r/MechanicAdvice/comments/1lxofr3/need_advice_on_2011_equinox_lt_24_ecotech_exhaust/
MechanicAdvice,Choke light and stall out,"I have an 82 Firebird TransAm MSE with a 305 carburetor. After driving on the highway and coming to a complete stop my choke like comes on and I stall out. Is this a problem with my fuel pump? Or could this just be a tuning issue? I originally thought my fuel lines were dirty so I used one of the fuel cleaners and it was ok for a day or two, and after that back to stalling out. ",1,2025-07-11 18:40:46,https://www.reddit.com/r/MechanicAdvice/comments/1lxof5b/choke_light_and_stall_out/,https://www.reddit.com/r/MechanicAdvice/comments/1lxof5b/choke_light_and_stall_out/
MechanicAdvice,"ISSUE – Seat Ibiza 1.2 TDI 2011 – Glow Plug Light Flashing, Power Loss, Occasional Check Engine Light","Hey everyone,
I’m having an ongoing and very annoying issue with my Seat Ibiza 1.2 TDI from 2011 (3-cylinder diesel engine).

Here’s what’s happening:
	•	While driving, the glow plug light starts flashing intermittently
	•	When it happens, the car loses power, starts vibrating, and feels like it’s struggling
	•	Sometimes, the Check Engine Light (CEL) also comes on, but it turns off by itself after restarting the engine a couple of times

Strange part:
	•	If I turn the car off and back on, the issue disappears temporarily
	•	Sometimes it doesn’t happen for weeks, then suddenly it’s back again
	•	The CEL only shows up occasionally, and doesn’t always stay on

What I’ve done so far:
	•	I’ve cleaned the fuel tank (I thought it could be sediment or dirty diesel)
	•	No ECU tuning or modifications
	•	I always fuel up at decent stations

I’ve read it could be:
	•	A DPF (FAP) issue
	•	A bad or clogged EGR valve
	•	A faulty brake pedal sensor (heard this causes flashing glow plug lights on VAG cars)
	•	Or maybe a failing injector

I haven’t done a proper VCDS or OBD scan yet, but I plan to soon.
Has anyone experienced something similar with this engine?
Any idea where I should start looking or what error codes to expect?

Any help would be much appreciated. 🙏
",1,2025-07-11 18:32:06,https://www.reddit.com/r/MechanicAdvice/comments/1lxo8wn/issue_seat_ibiza_12_tdi_2011_glow_plug_light/,https://www.reddit.com/r/MechanicAdvice/comments/1lxo8wn/issue_seat_ibiza_12_tdi_2011_glow_plug_light/
MechanicAdvice,Has my brand new starter motor kicked the bucket?,"Starter motor was getting very tired/ slow on a car that im working on/ trying to get going (Audi Q7, 3.0TDI).   
Replaced with a new starter motor, which turned over fast at first, then started to get tired like the battery was going flat - thing is the battery is new (fully charged) and even with jump cables connected to another car started to barely crank the car. I removed the glow plugs (to make sure it wasn't hydrolocking with fuel) and barely made a difference, even with glow plugs out.  
Now, It barely cranks the car, even though you can turn the car over by hand (with a socket and breaker bar). It also used to crank for ages, but now only does about 2 slow revolutions and gives up. 

I put a multimeter on battery, and the crank voltage drops to 10-11v.   
I then put multimeter on engine ground and starter solenoid contact, and another test to the main positive cable, and volt drops to the same, 10-11v when cranking, which should be more than enough?  
  
Which tells me it has to be the starter motor right?  
I have also lost contact with ECU through OBD and the car seems to have a multitude of electrical issues, but if the start motor is getting full voltage, the crank issue has to be with the starter, right?  


Thanks in advance for any replies",1,2025-07-11 18:29:12,https://www.reddit.com/r/MechanicAdvice/comments/1lxo6r2/has_my_brand_new_starter_motor_kicked_the_bucket/,https://www.reddit.com/r/MechanicAdvice/comments/1lxo6r2/has_my_brand_new_starter_motor_kicked_the_bucket/
MechanicAdvice,Is it my battery or my alternator,I drive a 2014 jeep Cherokee latitude. I don’t know much about cars. On my way home my battery light came on. My voltage on the dashboard was below ten. I sat in my vehicle for a while and watched the voltage meter go down and up and back and forth until my jeep nearly died I turned off the vehicle and then waited and started again it started right up I haven’t had any issues not needing any jumps or anything. My battery is from 2021. I did smell some burning but I couldn’t tell if that was coming from the cigarette smell in my vehicle or if that was the alternator (I did read if it was alternator it could have an electrical or burning smell) I’m at a loss I have plans this weekend and need my vehicle. ,1,2025-07-11 18:26:24,https://www.reddit.com/r/MechanicAdvice/comments/1lxo4qe/is_it_my_battery_or_my_alternator/,https://www.reddit.com/r/MechanicAdvice/comments/1lxo4qe/is_it_my_battery_or_my_alternator/
MechanicAdvice,01 Ram 1500 5.9,"I've got a Ram with the notorious no bus issue. Also a crank no start I have replaced, crank position sensor, throttle position sensor, cap and rotor, coil pack and fuel pump, previous owner replaced ignition oil pressure sensor and ecu truck did run and drive until recently stalling out and hasn't started since. I'm out of ideas, any advice would be appreciated, I need my truck back on the road.",1,2025-07-11 18:07:44,https://www.reddit.com/r/MechanicAdvice/comments/1lxnr4t/01_ram_1500_59/,https://www.reddit.com/r/MechanicAdvice/comments/1lxnr4t/01_ram_1500_59/
MechanicAdvice,Alternator issues?? Need help,"Hi, I know absolutely nothing about cars and really need some help figuring this out.

I bought a 2013 Dodge Journey from a family friend not too long ago. Ever since i got it, I have had an issue where if i don’t drive my car for a day, the battery will die. I never had any lights show on my dash.

I took it to the mechanic and they told me it was an issue with the alternator and replaced it.
when i went to pick my car up from the mechanic, my car felt more jittery then normal. about 15 minutes into my drive home, my battery light came on. 

I took it for a drive a couple hours later to make sure it was driving ok. Shortly after I started the car I got a message saying something along the lines of “Park Assist System”. I didn’t make it far before both speedometers stopped telling me how fast i was going, my ac stopped working (would turn on and off repeatedly blowing hot air), my windows wouldn’t roll down, and my screen controlling my climate, radio, etc turned off. My car also sounded louder than normal.

Does anyone have any ideas on what the issue could be? I’m going to attempt to take it back in on monday, but i’d like to be prepared on what might be wrong. Thank you so much!",1,2025-07-11 18:04:27,https://www.reddit.com/r/MechanicAdvice/comments/1lxnoqv/alternator_issues_need_help/,https://www.reddit.com/r/MechanicAdvice/comments/1lxnoqv/alternator_issues_need_help/
MechanicAdvice,2013 Honda Civic EX EPS Issues,"Hi all first time reddit user and post.

I'm not a professional mechanic but dangerous, so most repairs I can handle in my own garage. 

I have a 2013 Honda Civic EX 1.8L with an EPS failure (by that I mean it's very difficult to steer and I have the EPS light on in the dash). 
 
Troubleshooting I've done includes checking the motor side and module side wiring for wear, corrosion, etc. with no findings. Battery connections are good with no corrosio. Note that the battery is new within the last 2 months.  Battery holds approx. 12 volts with the car off. Battery reads 13.07v at idle under load (lights, rear defroster, AC, etc.) and a.voltage drop off the alternator of 0.21v. 

I don't want to sink money on an alternator or new module without additional advice so I'm here in reddit. I'm also open to other troubleshooting steps.to help identify the root cause and part that needs replaced. 

Thanks in advance!",1,2025-07-11 17:38:12,https://www.reddit.com/r/MechanicAdvice/comments/1lxn5hi/2013_honda_civic_ex_eps_issues/,https://www.reddit.com/r/MechanicAdvice/comments/1lxn5hi/2013_honda_civic_ex_eps_issues/
MechanicAdvice,Chevrolet Malibu transmission,"I have a 2021 Chevrolet Malibu LT 1.5. The transmission solenoid seems to be shut off according to the engine code replace the valve body and the solenoid control body and got a reprogram after this the issue kept going, which would not allow her to shift into drive and zero sometimes wood shifting to drive it would be stuck in high or fiancé and not want to shift into new gears what could be wrong with the transmission if I changed all new parts of what the engine clothes are saying and the engine code is still the same after being replaced? Please help ",1,2025-07-11 16:54:18,https://www.reddit.com/r/MechanicAdvice/comments/1lxm8xo/chevrolet_malibu_transmission/,https://www.reddit.com/r/MechanicAdvice/comments/1lxm8xo/chevrolet_malibu_transmission/
MechanicAdvice,"Far from knowledgeable, is this serious?","Hi,

I recently started to hear a sort of clicking/chittering when turning. Had a look to see if anything was obvious to see this (Google says tie rod?) leaking fluid from a tear in the black rubber!

I'll be taking it to an mechanic as soon as possible, but given we're going into a weekend and then I'd have to get a time it could be a week or so before it's fixed.

Is it something serious to the extent the car shouldn't be driven? I rely really heavily on it but I drive my kids in this and don't want to put them in danger if it's a serious, do not drive this, sort of issue.

As I'm sure if obvious I'm all but clueless about this and paranoia is setting in!

Thanks!",1,2025-07-11 16:46:40,https://i.redd.it/mx1tvn5y0ccf1.jpeg,https://www.reddit.com/r/MechanicAdvice/comments/1lxm32t/far_from_knowledgeable_is_this_serious/
MechanicAdvice,Vapor coming out of the AC and check engine light went on,"Hi all. Earlier today, going a pretty quick speed on the highway, I drove over a pretty large piece of someone’s debris from their car. A couple of hundred miles later vapors started coming out of the AC vents and the check engine light went on. When opening the hood, although I don’t have experience with how hot it is in there, the engine seemed pretty pretty hot. Any idea if the event earlier today is connected and/ or what the issue may be currently with my
",2,2025-07-11 16:39:50,https://www.reddit.com/r/MechanicAdvice/comments/1lxlxn9/vapor_coming_out_of_the_ac_and_check_engine_light/,https://www.reddit.com/r/MechanicAdvice/comments/1lxlxn9/vapor_coming_out_of_the_ac_and_check_engine_light/
MechanicAdvice,302w timing issues,So we have this 68 cougar with a 302w it ran and drove before we decided to put this intake and the aces high roller ignition system on it. But now we cant seem to get it into time we've tried the regular and the ho firing order and it kind of runs on the regular but it hardly wants to start and once it does every couple of seconds its popping out the carb. When we put the distributor in we made sure it was TDC on cylinder 1 and that the rotor on the distributor was pointed in what we believed to be the right direction. Any advice would be great appreciated.,1,2025-07-11 16:39:45,https://www.reddit.com/r/MechanicAdvice/comments/1lxlxl9/302w_timing_issues/,https://www.reddit.com/r/MechanicAdvice/comments/1lxlxl9/302w_timing_issues/
MechanicAdvice,I’m not sure what else to do or how to fix this issue,"I drive a 2015 Hyundai Elantra and the car for the most part runs just fine especially on freeways but if it’s stopped(usually at intersections or red lights) it’ll stall and then the car won’t move even if I press the brake and gas so I have to turn the entire car off and restart it then when it turns car on it’ll start shaking and even when I press the gas it’ll barely run until I pull over and give it time to reset. 
The car also “breaks down” at random times and is unpredictable when it’ll do it
More info if needed: when the car is stalled the check engine light, battery warning light, and the engine oil warning light turns on. But when I restart the car all of the lights turn off. The check engine stayed on longer other day but then eventually turned off a couple hours later. 
I’ve taken it to oreillys for a battery and engine light test and they both came up with good signs. I’ve also taken the car to two different mechanics who ran diagnostics on the car but both found nothing wrong with it. There was a recall on the car but I have also taken it to the dealership to get it fixed. 
Like the title says I’m not sure what else to do and where else to take especially since it is seemingly fine. ",1,2025-07-11 16:12:34,https://www.reddit.com/r/MechanicAdvice/comments/1lxlbw0/im_not_sure_what_else_to_do_or_how_to_fix_this/,https://www.reddit.com/r/MechanicAdvice/comments/1lxlbw0/im_not_sure_what_else_to_do_or_how_to_fix_this/
